{
  "schema_version": "1.0.0",
  "idea_id": "motivation_first_action_001",
  "assets": [
    {
      "asset_id": "asset_phone_desk",
      "local_path": "assets/footage/phone-desk.mp4",
      "landing_url": "https://www.pexels.com/video/woman-using-a-phone-8439809/",
      "download_url": "https://videos.pexels.com/video-files/8439809/8439809-hd_1080_1920_25fps.mp4",
      "creator": "Vlada Karpovich",
      "license": "Pexels License",
      "license_url": "https://www.pexels.com/license/",
      "license_receipt": "assets/rights/RIGHTS_LEDGER.md",
      "retrieved_at": "2026-08-27T12:00:00+03:00",
      "commercial_use": true,
      "modification_allowed": true,
      "attribution_required": false,
      "attribution_text": null,
      "model_release": "unknown",
      "property_release": "unknown",
      "platforms": ["youtube_shorts", "instagram_reels", "tiktok"],
      "territories": ["worldwide"],
      "expires_at": null,
      "rights_status": "approved",
      "notes": "Generic illustrative use only; no endorsement or personal claim."
    },
    {
      "asset_id": "asset_todo_list",
      "local_path": "assets/footage/todo-list.mp4",
      "landing_url": "https://www.pexels.com/video/person-writing-a-to-do-list-7597168/",
      "download_url": "https://videos.pexels.com/video-files/7597168/7597168-hd_1080_1920_24fps.mp4",
      "creator": "Miriam Alonso",
      "license": "Pexels License",
      "license_url": "https://www.pexels.com/license/",
      "license_receipt": "assets/rights/RIGHTS_LEDGER.md",
      "retrieved_at": "2026-08-27T12:00:00+03:00",
      "commercial_use": true,
      "modification_allowed": true,
      "attribution_required": false,
      "attribution_text": null,
      "model_release": "unknown",
      "property_release": "unknown",
      "platforms": ["youtube_shorts", "instagram_reels", "tiktok"],
      "territories": ["worldwide"],
      "expires_at": null,
      "rights_status": "approved",
      "notes": "Task-planning illustration."
    },
    {
      "asset_id": "asset_put_on_shoe",
      "local_path": "assets/footage/put-on-shoe.mp4",
      "landing_url": "https://www.pexels.com/video/a-person-putting-on-a-shoe-8994347/",
      "download_url": "https://videos.pexels.com/video-files/8994347/8994347-hd_1080_1920_25fps.mp4",
      "creator": "Alena Darmel",
      "license": "Pexels License",
      "license_url": "https://www.pexels.com/license/",
      "license_receipt": "assets/rights/RIGHTS_LEDGER.md",
      "retrieved_at": "2026-08-27T12:00:00+03:00",
      "commercial_use": true,
      "modification_allowed": true,
      "attribution_required": false,
      "attribution_text": null,
      "model_release": "unknown",
      "property_release": "unknown",
      "platforms": ["youtube_shorts", "instagram_reels", "tiktok"],
      "territories": ["worldwide"],
      "expires_at": null,
      "rights_status": "approved",
      "notes": "Minimal exercise-start illustration."
    },
    {
      "asset_id": "asset_typing_coffee",
      "local_path": "assets/footage/typing-coffee.mp4",
      "landing_url": "https://www.pexels.com/video/a-man-using-a-laptop-and-drinking-coffee-8473761/",
      "download_url": "https://videos.pexels.com/video-files/8473761/8473761-hd_1920_1080_25fps.mp4",
      "creator": "Cup of Couple",
      "license": "Pexels License",
      "license_url": "https://www.pexels.com/license/",
      "license_receipt": "assets/rights/RIGHTS_LEDGER.md",
      "retrieved_at": "2026-08-27T12:00:00+03:00",
      "commercial_use": true,
      "modification_allowed": true,
      "attribution_required": false,
      "attribution_text": null,
      "model_release": "unknown",
      "property_release": "unknown",
      "platforms": ["youtube_shorts", "instagram_reels", "tiktok"],
      "territories": ["worldwide"],
      "expires_at": null,
      "rights_status": "approved",
      "notes": "Work-start illustration; repeated crop is tracked in editorial review."
    },
    {
      "asset_id": "asset_tidy_desk",
      "local_path": "assets/footage/tidy-desk.mp4",
      "landing_url": "https://www.pexels.com/video/a-man-tidying-up-his-desk-10567192/",
      "download_url": "https://videos.pexels.com/video-files/10567192/10567192-hd_1080_2048_25fps.mp4",
      "creator": "Ron Lach",
      "license": "Pexels License",
      "license_url": "https://www.pexels.com/license/",
      "license_receipt": "assets/rights/RIGHTS_LEDGER.md",
      "retrieved_at": "2026-08-27T12:00:00+03:00",
      "commercial_use": true,
      "modification_allowed": true,
      "attribution_required": false,
      "attribution_text": null,
      "model_release": "unknown",
      "property_release": "unknown",
      "platforms": ["youtube_shorts", "instagram_reels", "tiktok"],
      "territories": ["worldwide"],
      "expires_at": null,
      "rights_status": "approved",
      "notes": "One-item declutter illustration."
    },
    {
      "asset_id": "asset_sticky_note",
      "local_path": "assets/footage/sticky-note.mp4",
      "landing_url": "https://www.pexels.com/video/person-putting-notes-on-a-board-5740702/",
      "download_url": "https://videos.pexels.com/video-files/5740702/5740702-hd_1080_1920_24fps.mp4",
      "creator": "Zen Chung",
      "license": "Pexels License",
      "license_url": "https://www.pexels.com/license/",
      "license_receipt": "assets/rights/RIGHTS_LEDGER.md",
      "retrieved_at": "2026-08-27T12:00:00+03:00",
      "commercial_use": true,
      "modification_allowed": true,
      "attribution_required": false,
      "attribution_text": null,
      "model_release": "unknown",
      "property_release": "unknown",
      "platforms": ["youtube_shorts", "instagram_reels", "tiktok"],
      "territories": ["worldwide"],
      "expires_at": null,
      "rights_status": "approved",
      "notes": "If-then planning illustration."
    },
    {
      "asset_id": "asset_shoes_clock",
      "local_path": "assets/footage/shoes-clock.mp4",
      "landing_url": "https://www.pexels.com/video/running-shoes-and-a-wall-clock-6514955/",
      "download_url": "https://videos.pexels.com/video-files/6514955/6514955-hd_1080_1286_30fps.mp4",
      "creator": "Fatih Avci",
      "license": "Pexels License",
      "license_url": "https://www.pexels.com/license/",
      "license_receipt": "assets/rights/RIGHTS_LEDGER.md",
      "retrieved_at": "2026-08-27T12:00:00+03:00",
      "commercial_use": true,
      "modification_allowed": true,
      "attribution_required": false,
      "attribution_text": null,
      "model_release": "not_applicable",
      "property_release": "unknown",
      "platforms": ["youtube_shorts", "instagram_reels", "tiktok"],
      "territories": ["worldwide"],
      "expires_at": null,
      "rights_status": "approved",
      "notes": "Timer motif without an identifiable person."
    },
    {
      "asset_id": "voice_fish_audio",
      "local_path": "assets/audio/fish-voice.wav",
      "landing_url": "https://fish.audio/",
      "download_url": null,
      "creator": "User-supplied Fish Audio generation",
      "license": "Fish Audio Terms of Use; commercial rights depend on a paid plan and an owned verified voice",
      "license_url": "https://fish.audio/es/terms/",
      "license_receipt": null,
      "retrieved_at": "2026-08-27T20:29:00+03:00",
      "commercial_use": false,
      "modification_allowed": false,
      "attribution_required": false,
      "attribution_text": null,
      "model_release": "required",
      "property_release": "not_applicable",
      "platforms": ["youtube_shorts", "instagram_reels", "tiktok"],
      "territories": ["worldwide"],
      "expires_at": null,
      "rights_status": "human_review",
      "notes": "Approved for the internal control render. Before commercial publication, confirm that the generating Fish Audio account was Premium and that the selected voice is owned and verified by the user."
    }
  ],
  "decision": {
    "passed": false,
    "needs_human_review": true,
    "missing_asset_ids": ["voice_fish_audio"],
    "review_notes": [
      "All seven visual assets are approved under the recorded Pexels license.",
      "External publication is blocked until the Fish Audio paid-plan and owned-verified-voice conditions are confirmed."
    ]
  }
}
